{
  "format": "openbindings.binding-spec-processor-scenarios@1",
  "bindingSpec": "openbindings.openapi@2",
  "family": "openapi",
  "description": "Portable processor scenarios for OpenAPI decisions sharpened during the 0.2.0 review. Configuration is named semantically; adapters normalize HTTP observations.",
  "scenarios": [
    {
      "id": "OAPI-PS-01",
      "rules": ["OAPI-P-01"],
      "section": "3",
      "description": "A later patch-looking OpenAPI edition is refused at load instead of accepted by version-line inference.",
      "given": {
        "source": {
          "content": {
            "openapi": "3.1.3",
            "info": { "title": "Future", "version": "1" },
            "paths": {}
          }
        },
        "binding": { "ref": "#/paths/~1x/get" },
        "invocation": { "inputPresent": false }
      },
      "expected": [
        {
          "disposition": "refusal",
          "phase": "load",
          "assertions": [{ "path": "/dispatch", "absent": true }]
        }
      ]
    },
    {
      "id": "OAPI-PS-02",
      "rules": ["OAPI-P-02"],
      "section": "9.1",
      "description": "A scalar query parameter uses the OpenAPI-declared query location and serialization rather than becoming a body field.",
      "given": {
        "source": {
          "location": "https://api.example/openapi.json",
          "content": {
            "openapi": "3.0.4",
            "info": { "title": "Search", "version": "1" },
            "servers": [{ "url": "https://api.example" }],
            "paths": {
              "/search": {
                "get": {
                  "parameters": [
                    {
                      "name": "limit",
                      "in": "query",
                      "schema": { "type": "integer" }
                    }
                  ],
                  "responses": {
                    "200": {
                      "description": "ok",
                      "content": { "application/json": {} }
                    }
                  }
                }
              }
            }
          }
        },
        "binding": { "ref": "#/paths/~1search/get" },
        "invocation": { "inputPresent": true, "input": { "limit": 2 } },
        "peer": {
          "status": 200,
          "headers": { "Content-Type": "application/json" },
          "body": "[]"
        }
      },
      "expected": [
        {
          "disposition": "complete",
          "phase": "completion",
          "assertions": [
            { "path": "/dispatch/method", "equals": "GET" },
            {
              "path": "/dispatch/url",
              "equals": "https://api.example/search?limit=2"
            },
            { "path": "/dispatch/body", "absent": true },
            { "path": "/dispatch/headers/Content-Type", "absent": true },
            { "path": "/outputs", "equals": [[]] }
          ]
        }
      ]
    },
    {
      "id": "OAPI-PS-03",
      "rules": ["OAPI-P-03"],
      "section": "9.1",
      "description": "Same-named path and query parameters remain independently writable through the revision-2 routed source representation.",
      "given": {
        "source": {
          "content": {
            "openapi": "3.1.2",
            "info": { "title": "Collision", "version": "1" },
            "servers": [{ "url": "https://api.example" }],
            "paths": {
              "/items/{id}": {
                "get": {
                  "parameters": [
                    {
                      "name": "id",
                      "in": "path",
                      "required": true,
                      "schema": { "type": "string" }
                    },
                    {
                      "name": "id",
                      "in": "query",
                      "schema": { "type": "string" }
                    }
                  ],
                  "responses": { "200": { "description": "ok" } }
                }
              }
            }
          }
        },
        "binding": { "ref": "#/paths/~1items~1{id}/get" },
        "invocation": {
          "inputPresent": true,
          "input": [
            {
              "$openbindings": "openbindings.openapi@2",
              "value": { "pathId": "path-value", "queryId": "query-value" },
              "parameters": [
                { "in": "path", "name": "id", "field": "pathId" },
                { "in": "query", "name": "id", "field": "queryId" }
              ],
              "body": {}
            }
          ]
        },
        "peer": { "status": 200, "body": "" }
      },
      "expected": [
        {
          "disposition": "complete",
          "phase": "completion",
          "assertions": [
            {
              "path": "/dispatch/url",
              "equals": "https://api.example/items/path-value?id=query-value"
            },
            { "path": "/dispatch/body", "absent": true },
            { "path": "/outputs", "equals": [] }
          ]
        }
      ]
    },
    {
      "id": "OAPI-PS-04",
      "rules": ["OAPI-P-04"],
      "section": "9.2",
      "description": "Two declared JSON-family request media are preserved as alternatives; the corpus lists both without preference.",
      "given": {
        "source": {
          "content": {
            "openapi": "3.1.0",
            "info": { "title": "Media", "version": "1" },
            "servers": [{ "url": "https://api.example" }],
            "paths": {
              "/items": {
                "post": {
                  "requestBody": {
                    "required": true,
                    "content": {
                      "application/json": { "schema": { "type": "object" } },
                      "application/vnd.example+json": {
                        "schema": { "type": "object" }
                      }
                    }
                  },
                  "responses": { "204": { "description": "done" } }
                }
              }
            }
          }
        },
        "binding": { "ref": "#/paths/~1items/post" },
        "invocation": { "inputPresent": true, "input": { "name": "A" } },
        "peer": { "status": 204, "body": "" }
      },
      "expected": [
        {
          "disposition": "complete",
          "phase": "completion",
          "description": "application/json selected",
          "assertions": [
            {
              "path": "/dispatch/headers/Content-Type",
              "equals": "application/json"
            },
            { "path": "/outputs", "equals": [] }
          ]
        },
        {
          "disposition": "complete",
          "phase": "completion",
          "description": "vendor +json selected",
          "assertions": [
            {
              "path": "/dispatch/headers/Content-Type",
              "equals": "application/vnd.example+json"
            },
            { "path": "/outputs", "equals": [] }
          ]
        }
      ]
    },
    {
      "id": "OAPI-PS-05",
      "rules": ["OAPI-P-04"],
      "section": "9.2",
      "description": "An operation with no concrete success-response media omits Accept instead of inventing application/json.",
      "given": {
        "source": {
          "content": {
            "openapi": "3.1.0",
            "info": { "title": "No media", "version": "1" },
            "servers": [{ "url": "https://api.example" }],
            "paths": {
              "/ping": {
                "get": { "responses": { "204": { "description": "empty" } } }
              }
            }
          }
        },
        "binding": { "ref": "#/paths/~1ping/get" },
        "invocation": { "inputPresent": false },
        "peer": { "status": 204, "body": "" }
      },
      "expected": [
        {
          "disposition": "complete",
          "phase": "completion",
          "assertions": [
            { "path": "/dispatch/headers/Accept", "absent": true },
            { "path": "/outputs", "equals": [] }
          ]
        }
      ]
    },
    {
      "id": "OAPI-PS-06",
      "rules": ["OAPI-P-06", "OAPI-P-07", "OAPI-P-08"],
      "section": "9.5",
      "description": "A 201 response uses the default declaration for response media/decode but remains successful because classification is independently 2xx.",
      "given": {
        "source": {
          "content": {
            "openapi": "3.1.0",
            "info": { "title": "Default response", "version": "1" },
            "servers": [{ "url": "https://api.example" }],
            "paths": {
              "/items": {
                "post": {
                  "responses": {
                    "default": {
                      "description": "any",
                      "content": { "text/plain": {} }
                    }
                  }
                }
              }
            }
          }
        },
        "binding": { "ref": "#/paths/~1items/post" },
        "invocation": { "inputPresent": false },
        "peer": {
          "status": 201,
          "headers": { "Content-Type": "text/plain; charset=utf-8" },
          "body": "made"
        }
      },
      "expected": [
        {
          "disposition": "complete",
          "phase": "completion",
          "assertions": [
            { "path": "/dispatch/headers/Accept", "equals": "text/plain" },
            { "path": "/outputs", "equals": ["made"] }
          ]
        }
      ]
    },
    {
      "id": "OAPI-PS-07",
      "rules": ["OAPI-P-06", "OAPI-P-08"],
      "section": "9.5",
      "description": "The same default declaration may describe a 404 body but never upgrades that non-2xx status into success.",
      "given": {
        "source": {
          "content": {
            "openapi": "3.1.0",
            "info": { "title": "Default failure", "version": "1" },
            "servers": [{ "url": "https://api.example" }],
            "paths": {
              "/items": {
                "get": {
                  "responses": {
                    "default": {